[
  {
    "id": "SKILL-001",
    "title": "Arena_AI Provider Skill",
    "entry_path": "agents/Arena_AI/BOOT.md",
    "kind": "agent",
    "description": "Arena_AI provider boot skill — consumer/agency routing, privacy terms, model identity handling via BOOT.md + CAPABILITY_PROFILE + SOURCES.",
    "eval_ref": "evals/skills/SKILL-001.eval.md",
    "status": "active",
    "activation_note": "asserted",
    "tests": ["evals/skills/SKILL-001.eval.md"]
  },
  {
    "id": "SKILL-002",
    "title": "ChatGPT Provider Skill",
    "entry_path": "agents/ChatGPT/BOOT.md",
    "kind": "agent",
    "description": "ChatGPT provider boot skill — OpenAI consumer vs API data handling, usage policies, your-data guides via BOOT + CAPABILITY_PROFILE + SOURCES.",
    "eval_ref": "evals/skills/SKILL-002.eval.md",
    "status": "active",
    "activation_note": "asserted",
    "tests": ["evals/skills/SKILL-002.eval.md"]
  },
  {
    "id": "SKILL-003",
    "title": "Claude Provider Skill",
    "entry_path": "agents/Claude/BOOT.md",
    "kind": "agent",
    "description": "Claude provider boot skill — Anthropic privacy, commercial terms, AUP via BOOT + CAPABILITY_PROFILE + SOURCES.",
    "eval_ref": "evals/skills/SKILL-003.eval.md",
    "status": "active",
    "activation_note": "asserted",
    "tests": ["evals/skills/SKILL-003.eval.md"]
  },
  {
    "id": "SKILL-004",
    "title": "Gemini Provider Skill",
    "entry_path": "agents/Gemini/BOOT.md",
    "kind": "agent",
    "description": "Gemini provider boot skill — Google Gemini API terms, paid vs unpaid data use, usage policies via BOOT + CAPABILITY_PROFILE + SOURCES.",
    "eval_ref": "evals/skills/SKILL-004.eval.md",
    "status": "active",
    "activation_note": "asserted",
    "tests": ["evals/skills/SKILL-004.eval.md"]
  },
  {
    "id": "SKILL-005",
    "title": "Grok Provider Skill",
    "entry_path": "agents/Grok/BOOT.md",
    "kind": "agent",
    "description": "Grok provider boot skill — xAI privacy, terms, AUP via BOOT + CAPABILITY_PROFILE + SOURCES.",
    "eval_ref": "evals/skills/SKILL-005.eval.md",
    "status": "active",
    "activation_note": "asserted",
    "tests": ["evals/skills/SKILL-005.eval.md"]
  },
  {
    "id": "SKILL-006",
    "title": "colony — Bulk triage",
    "entry_path": "subskills/active/colony.md",
    "kind": "agent",
    "description": "Active subskill colony — bulk link/resource-dump triage, feeds curator ingestion queue, universal mode.",
    "eval_ref": "evals/skills/SKILL-006.eval.md",
    "status": "active",
    "activation_note": "pinned",
    "tests": ["evals/skills/SKILL-006.eval.md"]
  },
  {
    "id": "SKILL-007",
    "title": "fetch — Retrieval strategist",
    "entry_path": "subskills/active/fetch.md",
    "kind": "agent",
    "description": "Active subskill fetch — retrieval strategist over open-source bank, Brain registers to TOOLBOX, scout-gated online.",
    "eval_ref": "evals/skills/SKILL-007.eval.md",
    "status": "active",
    "activation_note": "pinned",
    "tests": ["evals/skills/SKILL-007.eval.md"]
  },
  {
    "id": "SKILL-008",
    "title": "overule — Commander override",
    "entry_path": "subskills/active/overule.md",
    "kind": "agent",
    "description": "Active subskill overule — Commander-triggered override, halt and redirect authority, logged activation.",
    "eval_ref": "evals/skills/SKILL-008.eval.md",
    "status": "active",
    "activation_note": "pinned",
    "tests": ["evals/skills/SKILL-008.eval.md"]
  },
  {
    "id": "SKILL-009",
    "title": "scout — Source-necessity gatekeeper",
    "entry_path": "subskills/active/scout.md",
    "kind": "agent",
    "description": "Active subskill scout — source-necessity gatekeeper, builds Acquisition Plan BEFORE prospector acquires.",
    "eval_ref": "evals/skills/SKILL-009.eval.md",
    "status": "active",
    "activation_note": "pinned",
    "tests": ["evals/skills/SKILL-009.eval.md"]
  },
  {
    "id": "SKILL-010",
    "title": "selfdirectives — Self-governed tasks",
    "entry_path": "subskills/active/selfdirectives.md",
    "kind": "agent",
    "description": "Active subskill selfdirectives — self-governed task generation, sources cue, grades autonomy tier, bounded execution.",
    "eval_ref": "evals/skills/SKILL-010.eval.md",
    "status": "active",
    "activation_note": "pinned",
    "tests": ["evals/skills/SKILL-010.eval.md"]
  },
  {
    "id": "SKILL-011",
    "title": "compass — Anti-drift",
    "entry_path": "subskills/passive/compass.md",
    "kind": "agent",
    "description": "Passive subskill compass — anti-drift, anchors mission, classifies deviation green/yellow/red, always on.",
    "eval_ref": "evals/skills/SKILL-011.eval.md",
    "status": "active",
    "activation_note": "asserted",
    "tests": ["evals/skills/SKILL-011.eval.md"]
  },
  {
    "id": "SKILL-012",
    "title": "curator — Ingestion",
    "entry_path": "subskills/passive/curator.md",
    "kind": "agent",
    "description": "Passive subskill curator — conditional passive auto-ingestion of all touched sources, drives ingest_collection.",
    "eval_ref": "evals/skills/SKILL-012.eval.md",
    "status": "active",
    "activation_note": "asserted",
    "tests": ["evals/skills/SKILL-012.eval.md"]
  },
  {
    "id": "SKILL-013",
    "title": "sentinel — Integrity watch",
    "entry_path": "subskills/passive/sentinel.md",
    "kind": "agent",
    "description": "Passive subskill sentinel — integrity watch, contradictions, ungraded claims, broken refs, decay, mechanized in checks.",
    "eval_ref": "evals/skills/SKILL-013.eval.md",
    "status": "active",
    "activation_note": "asserted",
    "tests": ["evals/skills/SKILL-013.eval.md"]
  },
  {
    "id": "SKILL-014",
    "title": "surgeon — Chief passive",
    "entry_path": "subskills/passive/surgeon.md",
    "kind": "agent",
    "description": "Passive subskill surgeon — chief passive, constitutional enforcement, halt authority, unconditional ALL modes.",
    "eval_ref": "evals/skills/SKILL-014.eval.md",
    "status": "active",
    "activation_note": "asserted",
    "tests": ["evals/skills/SKILL-014.eval.md"]
  },
  {
    "id": "SKILL-015",
    "title": "RESEARCH — prospector",
    "entry_path": "01-research/README.md",
    "kind": "procedure",
    "description": "Skill 1 RESEARCH — acquire knowledge from primary/secondary sources, logged source/date/type/authority, scout-gated.",
    "eval_ref": "evals/skills/SKILL-015.eval.md",
    "status": "active",
    "activation_note": "asserted",
    "tests": ["evals/skills/SKILL-015.eval.md"]
  },
  {
    "id": "SKILL-016",
    "title": "ANALYZE — decomposer",
    "entry_path": "02-analyze/README.md",
    "kind": "procedure",
    "description": "Skill 2 ANALYZE — decompose findings into claim tables, matrices, dependency maps, trace to Research IDs.",
    "eval_ref": "evals/skills/SKILL-016.eval.md",
    "status": "active",
    "activation_note": "asserted",
    "tests": ["evals/skills/SKILL-016.eval.md"]
  },
  {
    "id": "SKILL-017",
    "title": "DOSSIER — archivist",
    "entry_path": "03-dossier/README.md",
    "kind": "procedure",
    "description": "Skill 3 DOSSIER — stockpile intelligence into reusable dossiers, no ungraded claims, arsenal settled in Brain/long_term.",
    "eval_ref": "evals/skills/SKILL-017.eval.md",
    "status": "active",
    "activation_note": "asserted",
    "tests": ["evals/skills/SKILL-017.eval.md"]
  },
  {
    "id": "SKILL-018",
    "title": "INCUBATE — incubator",
    "entry_path": "04-incubate/README.md",
    "kind": "procedure",
    "description": "Skill 4 INCUBATE — sandbox [S]-grade matter, explicit promote/kill criteria, graduation log.",
    "eval_ref": "evals/skills/SKILL-018.eval.md",
    "status": "active",
    "activation_note": "asserted",
    "tests": ["evals/skills/SKILL-018.eval.md"]
  },
  {
    "id": "SKILL-019",
    "title": "ANNOTATE — annotator",
    "entry_path": "05-annotate/README.md",
    "kind": "procedure",
    "description": "Skill 5 ANNOTATE — attach margin notes, evidence grades, citation anchors, 100% graded before leaving.",
    "eval_ref": "evals/skills/SKILL-019.eval.md",
    "status": "active",
    "activation_note": "asserted",
    "tests": ["evals/skills/SKILL-019.eval.md"]
  },
  {
    "id": "SKILL-020",
    "title": "TRIANGULATE — triangulator",
    "entry_path": "06-triangulate/README.md",
    "kind": "procedure",
    "description": "Skill 6 TRIANGULATE — cross-verify ≥2 independent sources, 3 for Core-bound, conflicts in CONFLICT_REGISTER, only grade elevator.",
    "eval_ref": "evals/skills/SKILL-020.eval.md",
    "status": "active",
    "activation_note": "asserted",
    "tests": ["evals/skills/SKILL-020.eval.md"]
  },
  {
    "id": "SKILL-021",
    "title": "INSPECT — inspector",
    "entry_path": "07-inspect/README.md",
    "kind": "procedure",
    "description": "Skill 7 INSPECT — audit gathered material and repo for drift/debt/contradiction, classified critical/debt/drift/clean.",
    "eval_ref": "evals/skills/SKILL-021.eval.md",
    "status": "active",
    "activation_note": "asserted",
    "tests": ["evals/skills/SKILL-021.eval.md"]
  },
  {
    "id": "SKILL-022",
    "title": "OVERHAUL — surgeon",
    "entry_path": "08-overhaul/README.md",
    "kind": "procedure",
    "description": "Skill 8 OVERHAUL — dual citizenship, authors restructuring proposals, ratified ship as Patches, chief passive enforcement.",
    "eval_ref": "evals/skills/SKILL-022.eval.md",
    "status": "active",
    "activation_note": "asserted",
    "tests": ["evals/skills/SKILL-022.eval.md"]
  },
  {
    "id": "SKILL-023",
    "title": "NOTA — scribe",
    "entry_path": "09-nota/README.md",
    "kind": "procedure",
    "description": "Skill 9 NOTA — distill triangulated knowledge into final deliverables and Core cards, ≤300w, answer-first, Shield-Stamped only.",
    "eval_ref": "evals/skills/SKILL-023.eval.md",
    "status": "active",
    "activation_note": "asserted",
    "tests": ["evals/skills/SKILL-023.eval.md"]
  }
]
